[
  {
    "id": "architecture-abstraction-and-design",
    "name": "Architecture, Abstraction, and Design",
    "start": 1,
    "end": 112,
    "range": "0001-0112",
    "expected_count": 112
  },
  {
    "id": "language-semantics-and-formal-shape",
    "name": "Language, Semantics, and Formal Shape",
    "start": 113,
    "end": 249,
    "range": "0113-0249",
    "expected_count": 137
  },
  {
    "id": "data-state-and-representation",
    "name": "Data, State, and Representation",
    "start": 250,
    "end": 371,
    "range": "0250-0371",
    "expected_count": 122
  },
  {
    "id": "transformation-algorithms-and-working-verbs",
    "name": "Transformation, Algorithms, and Working Verbs",
    "start": 372,
    "end": 511,
    "range": "0372-0511",
    "expected_count": 140
  },
  {
    "id": "control-flow-coordination-and-temporal-logic",
    "name": "Control Flow, Coordination, and Temporal Logic",
    "start": 512,
    "end": 608,
    "range": "0512-0608",
    "expected_count": 97
  },
  {
    "id": "runtime-memory-and-execution",
    "name": "Runtime, Memory, and Execution",
    "start": 609,
    "end": 684,
    "range": "0609-0684",
    "expected_count": 76
  },
  {
    "id": "systems-programming-and-operating-system-words",
    "name": "Systems Programming and Operating-System Words",
    "start": 685,
    "end": 770,
    "range": "0685-0770",
    "expected_count": 86
  },
  {
    "id": "networking-and-distributed-systems",
    "name": "Networking and Distributed Systems",
    "start": 771,
    "end": 886,
    "range": "0771-0886",
    "expected_count": 116
  },
  {
    "id": "databases-persistence-and-time-binding-words",
    "name": "Databases, Persistence, and Time-Binding Words",
    "start": 887,
    "end": 968,
    "range": "0887-0968",
    "expected_count": 82
  },
  {
    "id": "security-trust-and-warding-words",
    "name": "Security, Trust, and Warding Words",
    "start": 969,
    "end": 1063,
    "range": "0969-1063",
    "expected_count": 95
  },
  {
    "id": "build-tooling-versioning-and-release",
    "name": "Build, Tooling, Versioning, and Release",
    "start": 1064,
    "end": 1139,
    "range": "1064-1139",
    "expected_count": 76
  },
  {
    "id": "testing-verification-and-observability",
    "name": "Testing, Verification, and Observability",
    "start": 1140,
    "end": 1210,
    "range": "1140-1210",
    "expected_count": 71
  },
  {
    "id": "hardware-embedded-and-performance-near-words",
    "name": "Hardware, Embedded, and Performance-Near Words",
    "start": 1211,
    "end": 1290,
    "range": "1211-1290",
    "expected_count": 80
  },
  {
    "id": "interface-ux-and-human-facing-words",
    "name": "Interface, UX, and Human-Facing Words",
    "start": 1291,
    "end": 1350,
    "range": "1291-1350",
    "expected_count": 60
  },
  {
    "id": "promptcraft-ai-oriented-engineering-and-spell-structure",
    "name": "Promptcraft, AI-Oriented Engineering, and Spell Structure",
    "start": 1351,
    "end": 1420,
    "range": "1351-1420",
    "expected_count": 70
  },
  {
    "id": "guarantee-words-quality-attributes-and-behavioral-adjectives",
    "name": "Guarantee Words, Quality Attributes, and Behavioral Adjectives",
    "start": 1421,
    "end": 1512,
    "range": "1421-1512",
    "expected_count": 92
  },
  {
    "id": "failure-words-pathologies-and-counter-spells",
    "name": "Failure Words, Pathologies, and Counter-Spells",
    "start": 1513,
    "end": 1582,
    "range": "1513-1582",
    "expected_count": 70
  },
  {
    "id": "compound-forms-prefixes-suffixes-and-naming-runes",
    "name": "Compound Forms, Prefixes, Suffixes, and Naming Runes",
    "start": 1583,
    "end": 1645,
    "range": "1583-1645",
    "expected_count": 63
  }
]
